[
  {
    "id": "S001",
    "title": "范冰（XDash）个人介绍",
    "url": "https://xdash.me/about/",
    "source_type": "profile",
    "published_at": null,
    "date_precision": "unknown",
    "date_basis": "本轮未确认首发日期",
    "date_source_ids": [],
    "checked_at": "2026-09-25",
    "review_status": "page_read",
    "verification_scope": "已核对页面正文；没有保存全文。",
    "evidence_origin": "self_published",
    "independence_group": "xdash-self-report",
    "summary": "确认研究对象、笔名和本人公开渠道。自述经历不自动等于第三方核验。",
    "locator": "正文",
    "rights_note": "未确认再分发许可；本库只收录链接、元数据与原创研究注释。",
    "archive_url": null
  },
  {
    "id": "S002",
    "title": "XDash GitHub 个人主页",
    "url": "https://github.com/xdash",
    "source_type": "profile",
    "published_at": null,
    "date_precision": "unknown",
    "date_basis": "本轮未确认首发日期",
    "date_source_ids": [],
    "checked_at": "2026-09-25",
    "review_status": "index_only",
    "verification_scope": "主页简介、外链和置顶仓库；未审计账号全部历史。",
    "evidence_origin": "self_published",
    "independence_group": "xdash-self-report",
    "summary": "账号链接回 xdash.me，并展示书籍和周刊仓库。",
    "locator": "正文",
    "rights_note": "未确认再分发许可；本库只收录链接、元数据与原创研究注释。",
    "archive_url": null
  },
  {
    "id": "S003",
    "title": "XDash Weblog 归档第 1 页",
    "url": "https://xdash.me/",
    "source_type": "archive_index",
    "published_at": null,
    "date_precision": "unknown",
    "date_basis": "本轮未确认首发日期",
    "date_source_ids": [],
    "checked_at": "2026-09-25",
    "review_status": "index_only",
    "verification_scope": "仅归档目录；不是该页所列全部文章已读，也不代表该年份全量。",
    "evidence_origin": "self_published",
    "independence_group": "xdash-self-report",
    "summary": "本轮可见 2025—2026 年的部分标题与发布日期；用于选样和日期交叉核对。",
    "locator": "正文",
    "rights_note": "未确认再分发许可；本库只收录链接、元数据与原创研究注释。",
    "archive_url": null
  },
  {
    "id": "S004",
    "title": "XDash Weblog 归档第 2 页",
    "url": "https://xdash.me/page/2/",
    "source_type": "archive_index",
    "published_at": null,
    "date_precision": "unknown",
    "date_basis": "本轮未确认首发日期",
    "date_source_ids": [],
    "checked_at": "2026-09-25",
    "review_status": "index_only",
    "verification_scope": "仅归档目录；不是该页所列全部文章已读，也不代表该年份全量。",
    "evidence_origin": "self_published",
    "independence_group": "xdash-self-report",
    "summary": "本轮可见 2023—2025 年的部分标题与发布日期；用于选样和日期交叉核对。",
    "locator": "正文",
    "rights_note": "未确认再分发许可；本库只收录链接、元数据与原创研究注释。",
    "archive_url": null
  },
  {
    "id": "S005",
    "title": "XDash Weblog 归档第 3 页",
    "url": "https://xdash.me/page/3/",
    "source_type": "archive_index",
    "published_at": null,
    "date_precision": "unknown",
    "date_basis": "本轮未确认首发日期",
    "date_source_ids": [],
    "checked_at": "2026-09-25",
    "review_status": "index_only",
    "verification_scope": "仅归档目录；不是该页所列全部文章已读，也不代表该年份全量。",
    "evidence_origin": "self_published",
    "independence_group": "xdash-self-report",
    "summary": "本轮可见 2020—2023 年的部分标题与发布日期；用于选样和日期交叉核对。",
    "locator": "正文",
    "rights_note": "未确认再分发许可；本库只收录链接、元数据与原创研究注释。",
    "archive_url": null
  },
  {
    "id": "S006",
    "title": "XDash Weblog 归档第 4 页",
    "url": "https://xdash.me/page/4/",
    "source_type": "archive_index",
    "published_at": null,
    "date_precision": "unknown",
    "date_basis": "本轮未确认首发日期",
    "date_source_ids": [],
    "checked_at": "2026-09-25",
    "review_status": "index_only",
    "verification_scope": "仅归档目录；不是该页所列全部文章已读，也不代表该年份全量。",
    "evidence_origin": "self_published",
    "independence_group": "xdash-self-report",
    "summary": "本轮可见 2014—2020 年的部分标题与发布日期；用于选样和日期交叉核对。",
    "locator": "正文",
    "rights_note": "未确认再分发许可；本库只收录链接、元数据与原创研究注释。",
    "archive_url": null
  },
  {
    "id": "S007",
    "title": "XDash Weblog 归档第 5 页",
    "url": "https://xdash.me/page/5/",
    "source_type": "archive_index",
    "published_at": null,
    "date_precision": "unknown",
    "date_basis": "本轮未确认首发日期",
    "date_source_ids": [],
    "checked_at": "2026-09-25",
    "review_status": "index_only",
    "verification_scope": "仅归档目录；不是该页所列全部文章已读，也不代表该年份全量。",
    "evidence_origin": "self_published",
    "independence_group": "xdash-self-report",
    "summary": "本轮可见 2011—2014 年的部分标题与发布日期；用于选样和日期交叉核对。",
    "locator": "正文",
    "rights_note": "未确认再分发许可；本库只收录链接、元数据与原创研究注释。",
    "archive_url": null
  },
  {
    "id": "S008",
    "title": "XDash Weblog 归档第 6 页",
    "url": "https://xdash.me/page/6/",
    "source_type": "archive_index",
    "published_at": null,
    "date_precision": "unknown",
    "date_basis": "本轮未确认首发日期",
    "date_source_ids": [],
    "checked_at": "2026-09-25",
    "review_status": "index_only",
    "verification_scope": "仅归档目录；不是该页所列全部文章已读，也不代表该年份全量。",
    "evidence_origin": "self_published",
    "independence_group": "xdash-self-report",
    "summary": "本轮可见 2010—2011 年的部分标题与发布日期；用于选样和日期交叉核对。",
    "locator": "正文",
    "rights_note": "未确认再分发许可；本库只收录链接、元数据与原创研究注释。",
    "archive_url": null
  },
  {
    "id": "S009",
    "title": "XDash Weblog 归档第 7 页",
    "url": "https://xdash.me/page/7/",
    "source_type": "archive_index",
    "published_at": null,
    "date_precision": "unknown",
    "date_basis": "本轮未确认首发日期",
    "date_source_ids": [],
    "checked_at": "2026-09-25",
    "review_status": "index_only",
    "verification_scope": "仅归档目录；不是该页所列全部文章已读，也不代表该年份全量。",
    "evidence_origin": "self_published",
    "independence_group": "xdash-self-report",
    "summary": "本轮可见 2010 年的部分标题与发布日期；用于选样和日期交叉核对。",
    "locator": "正文",
    "rights_note": "未确认再分发许可；本库只收录链接、元数据与原创研究注释。",
    "archive_url": null
  },
  {
    "id": "S010",
    "title": "XDash Weblog 归档第 8 页",
    "url": "https://xdash.me/page/8/",
    "source_type": "archive_index",
    "published_at": null,
    "date_precision": "unknown",
    "date_basis": "本轮未确认首发日期",
    "date_source_ids": [],
    "checked_at": "2026-09-25",
    "review_status": "index_only",
    "verification_scope": "仅归档目录；不是该页所列全部文章已读，也不代表该年份全量。",
    "evidence_origin": "self_published",
    "independence_group": "xdash-self-report",
    "summary": "本轮可见 2010 年的部分标题与发布日期；用于选样和日期交叉核对。",
    "locator": "正文",
    "rights_note": "未确认再分发许可；本库只收录链接、元数据与原创研究注释。",
    "archive_url": null
  },
  {
    "id": "S011",
    "title": "XDash Weblog 归档第 9 页",
    "url": "https://xdash.me/page/9/",
    "source_type": "archive_index",
    "published_at": null,
    "date_precision": "unknown",
    "date_basis": "本轮未确认首发日期",
    "date_source_ids": [],
    "checked_at": "2026-09-25",
    "review_status": "index_only",
    "verification_scope": "仅归档目录；不是该页所列全部文章已读，也不代表该年份全量。",
    "evidence_origin": "self_published",
    "independence_group": "xdash-self-report",
    "summary": "本轮可见 2010 年的部分标题与发布日期；用于选样和日期交叉核对。",
    "locator": "正文",
    "rights_note": "未确认再分发许可；本库只收录链接、元数据与原创研究注释。",
    "archive_url": null
  },
  {
    "id": "S012",
    "title": "XDash Weblog 归档第 10 页",
    "url": "https://xdash.me/page/10/",
    "source_type": "archive_index",
    "published_at": null,
    "date_precision": "unknown",
    "date_basis": "本轮未确认首发日期",
    "date_source_ids": [],
    "checked_at": "2026-09-25",
    "review_status": "index_only",
    "verification_scope": "仅归档目录；不是该页所列全部文章已读，也不代表该年份全量。",
    "evidence_origin": "self_published",
    "independence_group": "xdash-self-report",
    "summary": "本轮可见 2009 年的部分标题与发布日期；用于选样和日期交叉核对。",
    "locator": "正文",
    "rights_note": "未确认再分发许可；本库只收录链接、元数据与原创研究注释。",
    "archive_url": null
  },
  {
    "id": "S013",
    "title": "本博客相关资源整理汇总",
    "url": "https://xdash.me/my-resources.html",
    "source_type": "blog_post",
    "published_at": "2009-11-24",
    "date_precision": "day",
    "date_basis": "作者博客归档页标示的发布日期；不等同于内容所述事件日期",
    "date_source_ids": [
      "S012"
    ],
    "checked_at": "2026-09-25",
    "review_status": "page_read",
    "verification_scope": "已核对页面正文；没有保存全文。",
    "evidence_origin": "self_published",
    "independence_group": "xdash-self-report",
    "summary": "作者主动重整旧博客，提到知识结构整理；旧资源页使用 fanbing.net 域名。",
    "locator": "正文",
    "rights_note": "未确认再分发许可；本库只收录链接、元数据与原创研究注释。",
    "archive_url": null
  },
  {
    "id": "S014",
    "title": "我的个人知识管理工具 [PKM]",
    "url": "https://xdash.me/my-pkm-tools.html",
    "source_type": "blog_post",
    "published_at": "2010-05-02",
    "date_precision": "day",
    "date_basis": "作者博客归档页标示的发布日期；不等同于内容所述事件日期",
    "date_source_ids": [
      "S010"
    ],
    "checked_at": "2026-09-25",
    "review_status": "partial_read",
    "verification_scope": "核对开篇、工具选择原则与前半部分工具链；未逐一验证历史软件功能。",
    "evidence_origin": "self_published",
    "independence_group": "xdash-self-report",
    "summary": "将知识管理描述为从采集到实践、发表的过程，重视导出与互通。",
    "locator": "正文",
    "rights_note": "未确认再分发许可；本库只收录链接、元数据与原创研究注释。",
    "archive_url": null
  },
  {
    "id": "S015",
    "title": "互联网阅读学习经验",
    "url": "https://xdash.me/internet-reading.html",
    "source_type": "blog_post",
    "published_at": "2010-06-02",
    "date_precision": "day",
    "date_basis": "作者博客归档页标示的发布日期；不等同于内容所述事件日期",
    "date_source_ids": [
      "S009"
    ],
    "checked_at": "2026-09-25",
    "review_status": "page_read",
    "verification_scope": "已核对页面正文；没有保存全文。",
    "evidence_origin": "self_published",
    "independence_group": "xdash-self-report",
    "summary": "同时讨论优质信息筛选与 RSS 缩窄视野的风险。",
    "locator": "正文",
    "rights_note": "未确认再分发许可；本库只收录链接、元数据与原创研究注释。",
    "archive_url": null
  },
  {
    "id": "S016",
    "title": "我的互联网生涯（上）",
    "url": "https://xdash.me/my-internet-career-1.html",
    "source_type": "blog_post",
    "published_at": "2010-07-22",
    "date_precision": "day",
    "date_basis": "作者博客归档页标示的发布日期；不等同于内容所述事件日期",
    "date_source_ids": [
      "S009"
    ],
    "checked_at": "2026-09-25",
    "review_status": "page_read",
    "verification_scope": "已核对页面正文；没有保存全文。",
    "evidence_origin": "self_published",
    "independence_group": "xdash-self-report",
    "summary": "早期职业兴趣的本人回顾；仅作兴趣与建站线索，不扩展整理家庭隐私。",
    "locator": "正文",
    "rights_note": "未确认再分发许可；本库只收录链接、元数据与原创研究注释。",
    "archive_url": null
  },
  {